text,
పప్పు గారు ఆ ఒక్క నాయకుడు జగన్ అన్న. పందులు కలిసినట్టు కూటమి(ఓటమి) అని పేట్టుకుంది మీరు https:// twitter.com/naralokesh/sta tus/1099288527462817793 …,1
"గుర్తు తెలుయని వ్యక్తులు దాడి చేశారు అని జనసేన వీర మహిళలే చెప్తుంటే అది YCP పని అని పప్పు సెలవిచ్చాడు TDP-JSP బంధానికి ఇదొక ఉదాహరణ. ఈమధ్యనే సింగపూర్ లో JSP అధినేతకి 2వేల కోట్ల విలువ హోటల్ ఇచ్చి మరీ ఒప్పందం చేసుకున్నారు TDP వాళ్ళు,వచ్చే అన్నికల్లో కూడా TDP-JSP మైత్రి కొమసాగబోతుంది pic.twitter.com/7DEYNxIrRj",1
పప్పు & నిప్పు రేయింబవళ్ళు చేస్తున్న అభివృద్ధి ఇదేనా?? ప్రభుత్వ స్థలం ఏదైనా సరే @JaiTDP నాయకుల కన్ను పడితే చాలు నిమిషానికే కబ్జా చేస్తున్నారు. వీళ్ళకి అభివృద్ధి చేయడం చేత కాదు కానీ ఇంట్లో కూర్చుని మాత్రం చెత్త ట్వీట్లు చేసుకుంటూ పాకిస్తాన్ కి సపోర్ట్ చేసుకుంటూ ఉంటారు. pic.twitter.com/VlPlKGtqqW,1
వాళ్ళు దెంగ్గి తాగి కొట్టుకుంటే లవడా 99 టీవీ వైఎస్సార్సీపీ మీద విష ప్రచారం చెయ్యడం .. పప్పు గాడు సానుభూతి తెలపడం ఏమి డ్రామాలు రా.,1
""" పప్పు "" అని ఇందుకే అంటారు మరి....మీ పార్టీ వాళ్ళు ఇతర పార్టీ కార్యకర్తల మీద దాడి చేసినప్పుడు ఖండిస్తే అందరూ మిమ్మల్ని అభినందిస్తారు",1
అయ్యా పప్పు గారు 40 మంది వీర జవాన్లు మరణిస్తే ఖండించరు కానీ జగన్ అన్నని ఎదుర్కొనే సత్తా లేక ఇలాంటి ఆరోపణలు చేస్తారు. జగన్ అన్నతో ఢీ కొట్టే ధైర్యం లేకుండా లేకుండా చివరికి పాకిస్తాన్ కి కూడా సపోర్ట్ చేసేంత దిగజారుడు రాజకీయాలు చేయడానికి రెడీ అయ్యారు.. ఛీ,1
అవును పప్పు ..MRO ni isaka lo borlichhi kottadam Kuda manchi sampradayam..Kada,1
అంగన్వాడీ మహిళను ను రోడ్డు మీద కొట్టినప్పుడు ఎందుకు స్పందించలేదు చెప్పు 1st.... నువ్వు నీ పప్పు జోకులు...,1
సినబాబు నువ్వే అంటగా ఈ దాడి జరిపించింది.. నువ్వు చేసిన పని పక్కవాళ్ళ మీద నెట్టివేయడం నీకు మీ బాబు బొల్లిగాడికి అలవాటే కదా..! మీ నాయన వెన్నుపోటు గురించి పిట్టర్ లో రెట్టలు వేసుకో కానీ పక్కవాళ్ళ మీద వేస్తే బొచ్చు ఊడగొడతాం.ఈ పిట్టర్ లో రెట్టలు వెయ్యడం పప్పు తినడం తప్ప ఎమ్ చేయ్యలేవు https:// twitter.com/naralokesh/sta tus/1099524148538204160 …,1
పప్పు గారు చాలు టీడీపీ ని నేలమట్టం చేయడానికి. ఎవడు తీసుకున్న గోతులో వాడే పడతారు సర్,1
ప్రొదుటే ఏంట్రా బాబు మాకు నీ కామిడి.... వాళ్ళల్లో వాళ్ళు దెంగి తాగి కొట్టుకుంటే నీ బాధ ఏంటి ??వెళ్లి పప్పు తిను pic.twitter.com/MQiR1rWAjL,1
జనసేన పై వైసీపీ దాడి ని ఖండిస్తున్నాం - పప్పు సందు దొరికింది కదా అని నాటకాలు మింగడం... ఈ టీడీపీ ముండాకొడుకులు ఏదో పాతీతులైనట్టు....మీది అదే జాతిరా బేవర్స్.... #EndofTDPYCP https:// twitter.com/naralokesh/sta tus/1099524148538204160 …,1
కంది పప్పు ఒక పది కేజీలు తిన్నావా? అందుకే వై ఛీ పీ అంటు ఛీప్ మాటలు మాట్లాడుతున్నావు.,1
"అందుకే దొంగవోట్లు చేర్పించి, ప్రత్యర్థి పార్టీ వాళ్ళ ఓట్లను తీసేయించి దోడ్డి దారిన గెలవాలని చూస్తున్నావ్.అంతేనా దొడ్డిదారి మంత్రి గారు.నువ్వు నీ యబ్బ ఎప్పుడైనా సొంత బలం తో గెలిచారా.అయినా పార్టీనే జయప్రదం గా ఎత్తుకొచ్చి నోళ్ళకు ఇవన్నీ ఒక లెక్కా. అంతేనా పప్పు .",1
YSRCP కార్యకర్తలు దాడి చేస్థే ప్రూఫ్స్ ఎక్కడ రా...మా వాళ్లు ఏమి చెయ్యకుండానే అక్రమ కేసులు పెడ్తారు. మరి ఇప్పుడు ఎం అడ్డం వచ్చింది ర మీకు మీరే కొట్టేసుకొని..మీకు మీరే సానుభూతులు చెప్పేసుకుని..మా మీద పడి ఏడుస్తారెందుకు ర నిప్పు పప్పు కి ఒక పార్టనర్ ప్యాకేజీ స్టార్ అండ. @naralokesh https:// twitter.com/naralokesh/sta tus/1099524148538204160 …,1
పప్పు గారి ప్రవచనాలు... జనసేన కార్యకర్తల పై YSRCP కార్యకర్తలు దాడి చేసారని వాళ్ళ పార్టనర్ పార్టీకి సానుభూతి వ్యక్తంచేశారు మన మంత్రి పప్పు అలియాస్ లోకేశం... అయిన చీప్ గా జనసేన పైన దాడి చెయ్యడానికి మాకు టైం లేదు రా...జనసేన ని మేము ఒక పార్టీ గా గుర్తించడం లేదు. @naralokesh https:// twitter.com/naralokesh/sta tus/1099524148538204160 …,1
