text,
మీకు తెలంగాణలో వచ్చాయా డిపాజిట్లు మరీ... పప్పు పోటి చేస్తే గెలుస్తాడా???,1
"పప్పు గారు ప్యాకేజీ గారు అన్ని ఒక కాంపౌండ్ లో కుక్కలు అని మాకు తెలుసు, ఈ రాష్ట్రంలో టిడిపి గూండాలు, రౌడీ లను మించి ఎవరూ లేదు https:// twitter.com/naralokesh/sta tus/1099524148538204160 …",1
"జలగన్ అన్న తగ్గదు ...కాండిడేట్ దగ్గర పది కోట్లు పెట్టించి ఐన ఈసారి కర్నూల్ వసిసినప్పుడు కొండా రెడ్డి బురుజు గోడల కూడా కనపడకుండా జనం తో కప్పేయాలి .. మనం ఎంతైనా సీమ కింగ్ కదా.. పప్పు సర్ మీరు కూడా కుర్నల్ కొండా రెడ్డి బురుజు ఆర్డర్ చేసి ఒక పది కోట్లు రిలీజ్ చేయండి ,ప్రజా దానమేగ https:// twitter.com/BeSriSri/statu s/1099704168732913666 …",1
వెంటనే పప్పు గాడు ట్వీట్ చేసేసేవాడు,1
@RGVzoomin నేను మిమ్మల్ని అడుకొంటున్నాను మా లోకేశం బాబు గారి బయోపిక్ తియ్యండి లేకుంటే మిమ్మల్ని నేను బ్లొచ్క్ చేస్తా.అస్సలు ఒక్కదానికి రిప్లై ఇవ్వడం లేదు.,1
చింతమనేని ప్రభాకర్ గాడు దళితులకోసం అంత చులకనగా మాట్లాడితే దానికి ఈ పప్పుగాడు సమాధానం ప్రభాకర్ గాడు మాట్లాడేటప్పుడు జనం ఎంజాయ్ చేశారంటే దాంట్లో తప్పులేదంట మరి సర్ పప్పు లోకేష్ గారు మిమ్మల్ని పప్పు పప్పు అంటూనప్పుడు కూడా జనం ఎంజాయ్ చేస్తున్నారు అంటే మీరు నిజంగా పప్పున,1
నువ్వు కూడా పప్పు గాడిలాగా మాట్లాడకు... వాడు అంతే చూసి రమ్మంటే కాల్చి వస్తాడే...నేను ఫేక్ అని నిరూపించు లేకపోతే గుద్ద మూసుకొని పని చూస్కో బే బెప్పం,1
TDPని ఓడించడానికి మా బామ్మర్ది పప్పు చాలు....,1
పప్పు విషయంలో మా వాడు నిజాయితీ పరుడు జై లోకేషం,1
రోజు పప్పు నే గా కొట్టుకునేది ఈ సారి పప్పు తో పాటు మట్టి కూడా,1
మట్టి కాదు పప్పు కొట్టుకు పోతారు లోకేషం,1
"ప్రతి ఇంటి ఆడపిల్ల ను (ఆడపడుచులు) అత్తారింటికి పంపేటపుడు...ఉట్టి చేతులతో వెళ్ళకుండా కనీసం చలిమిడి చేసి పంపడం రివాజుగా వస్తుంది... ఉన్నవాళ్లు జీడిపప్పు, బాదం పప్పు కూడా కుమ్ముతున్నారు...",0
పప్పు బాబు మీకు జనసేనతో పొత్తు పెట్టుకోవాలంటే నేరుగా పెట్టుకోండి ప్రజలు తీర్పు ఎలా ఉంటుందో ప్రజలే నిర్ణయిస్తారు... అంతేకానీ వైసీపీ మీద కి తోసేసి జనసేనతో పొత్తు కోసం ప్రజల్ని పిచ్చోళ్ళు అనుకోకు.. మహిళలమీద మీ గౌరవం ఎలాంటిదో ఈ రాష్ట్ర ప్రజలు చూస్తున్నారు,1
"ఏమి అభివృద్ధి చేసావు స్వామి.నాలుగు రోడ్లు, 2 బాత్రూం లు, ఒక ఫోలు బల్బు...అంతే కదా",1
"థాంక్స్ పప్పు సార్, మా జనసేన తో పొత్తు పెట్టుకున్నందుకు. ఇక మా సైనికులు, పచ్చ దండు కలిసి రాష్ట్రాన్ని దున్నెద్దాం.",1
బాబు పప్పు లోకేష్.. సిగ్గుందా నీకు.. నువ్వు అన్నమే గా తినేది.. వనజాక్షి గారిని మీ చింతల ప్రభాకర్ చేయ చేసుకున్నప్పుడు ఏం పీకావ్ సామీ.. చీ.. ఇదేం రాజకీయం రా బాబు..మన పార్టీ అయితే అమ్మని అమ్మేసినా పర్లేదు.. పక్క పార్టీ వాళ్ళు అయితే పరాయి స్త్రీ నీ కల్లెత్తి కూడా చూడ కూడదు అంతేనా,1
"పప్పు : ఏంటి ఇది! జనమా, ప్రభంజనమా??? జైల్ జగన్: ఖచ్చితంగా వీడు కర్నూలోడు అయితే కాదు #జనసేనపోరాటయాత్ర pic.twitter.com/UwoEkVjnW1",1
"అన్నా అది టైపో మిస్టేక్, క్షమించండి పప్పు బదులుగా టైగర్ అని రాసారు, వాడి తరపున నేను క్షమాపణ అడుగుతున్నా",1
నేను చెప్పింది పప్పు గాడి గురుంచి వాడెబ్బ గురుంచి కాదు.... pic.twitter.com/kOH3MPXRLY,1
కేసీఆర్ గార్ని విమర్శించే స్థాయి కాదు పప్పు .రాజకీయలో కేసీఆర్ గారి కాలి గోటికి కూడ సరిపోవు నువ్వు.ఆంధ్రలో మీ పార్టీ ఫ్యామిలీ పరిస్థితి ఏంటో కొద్ది రోజుల్లో తెలుస్తుంది .. అతిపెద్ద భంగపాటు తప్పదు మీకు.మా కేసీఆర్ గారి రిటర్న్ గిఫ్ట్ కోసం వేచి చూడండి. ఘోర పరాజయం అవుతారు. @KTRTRS,1
చూశావా నువ్వు కూడా పప్పు అంటున్నావు... తు నీ నోట్లో మన్ను పడ.... చచ్చిపోండ్రా దరిద్రం వదిలిపోతాది మాకు,1
ఉగ్రవాదులు దాడి చేస్తే ట్విట్ చెయ్యడానికి టైం లేదు ప్రొదుటే లాంగొట్టా ఎగ్గొట్టుకొచ్చాడు పిల్ల సేన మీద సానుభూతి చూపించడానికి.... ఆపండ్రా మీ డ్రామాలు... నిన్ను నమ్మం బాబు & పప్పు,1
పప్పు పక్కెలి అడుకోవమా...,0
"నాయన. పప్పు ,మా జగన్మోహన్ రెడ్డిని ఎదురుకోలేక ,మీ నాన్న ,మోడీనీ ,పవన్ కళ్యాణ్ ను కాళ్ళు, చేతులు,పట్టుకున్నారు. గుర్తు ఉందా ? పప్పు .....",1
అందుకే అన్న నిన్ను అందరూ పప్పు అనేది తెలంగాణాలో చతికిలపడింది మీ తెలుగుదేశమే కదా......,1
పప్పు @naralokesh కు తెలుసు అంట....ఎవరో మీరు కూడా కామెంట్ చేయండి... pic.twitter.com/2678faxkC8,1
అదృష్టం కొద్దీ ఏంటి brother వాడి బాబు ని గెలిపించి నందుకు మనకు వేసిన శిక్ష ఈ చెత్త గన్నేరు పప్పు మంత్రి అవడం. వీడు కనీసం ప్యూన్ గా కూడా పనికిరాని బేవార్సు వెధవ,1
వాళ్లకు అంత దమ్ము లేదు చంద్రబాబు భయం పప్పు (లోకేష్)ని‌‌ ఎలా గెలిపించాలి అని.. https:// twitter.com/LaxRon3/status /1099344218043097088 …,1
"అందుకే నిన్ను అందరు పప్పు అనేది.మీకు దమ్ము,దైర్యం ఉంటే నిరూపించండి.",1
రేయ్ సానుభూతి చూపించి మళ్లీ పవన్ మాతోనే ఉన్నాడు అని చెప్పి పిచ్చ రాజకీయాలు చేయడానికి చెత్త లఫూట్ లేదా వైసీపీ పెట్టడానికి మంచి కారణం దొరికింది అనుకుంటున్నావా అందుకే కదా నిన్ను పప్పు అనేది https:// twitter.com/naralokesh/sta tus/1099524148538204160 …,1
YSRCP కార్యకర్తలు ఎప్పుడూ ఎవరి మీద దాడికి ప్రయత్నించలేదు..అలా చేసే అవసరం కూడా వాళ్ళకి లేదు...మీ పచ్చ పార్టీ లాగా మాకు ఎవరిని బెదిరించే ఉద్దేశం కూడా లేదు... పప్పు నువ్వు ట్విట్టర్లో ట్వీట్స్ కాకుండా ప్రజల్లోకి వచ్చి మాట్లాడు...!!!,1
ఆడ @JanaSenaParty వాళ్ళ లోకేశ్ బాగా రియాక్ట్ అయ్యాడు అంటే వాడే చేపించి ఉంటాడు..... నాకు తెలిసి ఇలాంటి పప్పు తెలివి తేటలు ఎక్కువ కదా? https:// twitter.com/taruns_/status /1099550774042869760 …,1
"పొత్తు జనంలోకి ఎలా తీసుకుని వెళ్ళాలి అని @ncbn @PawanKalyan నెల రోజుల నుంచి కింద, మీద పడుతుంటే భలే ఐడియా పప్పు ఇలా వైసీపీ దాడి చేసినట్టు మన బూతు మీడియా ద్వారా చూపించి, అరచకాన్ని ఓడించటానికి పొత్తు పెట్టుకున్నాం అంటే ఒకే. పావలా మీద దాడి చేసినప్పుడు నీ గు.. ఎందుకు ముసుకున్నావ్ ?? https:// twitter.com/naralokesh/sta tus/1099524148538204160 …",1
టీడీపీ జనసేన అక్రమ సంబంధంని బలపరుచు కోవాలి అంటే అలాగే కానివ్వండి అంతేగాని మా మీద అనవసరంగా బురధచల్ల్లోద్దు. పీకల్లోతు తాగి జనసేన కార్యకర్తలు కొట్టుకున్నారు మధ్యలో తగదు నమ్మా అంటూ నువ్వు వచ్చా వెంటరా గన్నేరు పప్పు గా @naralokesh ...?,1
ఓట్లు కొనడం ని నాన్నకు వెన్నతో పెట్టిన విద్య కదా పప్పు ... ఓటుకు 5కోట్లు ఇచ్చే కెపాసిటీ ఉంది ని నన్నారోకి,1
Me MLA ఒక గవర్నమెంట్ లేడీ ఆఫీసరని కొట్టినప్పడు లేదా.. .అప్పుడు లేవని నోరు ఇప్పుడు లేస్తోందే..... పప్పు,1
ఏ పప్పు మీ టెర్రరిస్ట్ దొంగల పార్టీ రౌడీలు కూడా అలాగే చేసిండ్రు..ఆరోజు కంట్లో ఎం పెట్టుకున్నావ్ దొంగ పుత్ర,1
వై సీ పి .. వాళ్లు కాదు పప్పు ...జనసేన వాళ్లే @naralokesh బెస్ట్ కమెడియన్ నువ్వే పో https:// twitter.com/naralokesh/sta tus/1099524148538204160 …,1
వై ఛీ పి నా? మిమ్మల్ని పప్పు అని అన్నది అందుకే అనుకుంటా. అసలు ఎటువంటి రుజువు లేకుండా ఎలా చెప్తావ్ అయ్యా నువ్వు? నీ తోడు దొంగల పార్టీ చేసే పనులే ఇవి.,1
ఒక మహిళ mro ని కొట్టిన మీ టీడీపీ ముండా కొడితే పప్పు తిని ఎక్కడ పడుకున్నావ్ ...గుంటూరు జిల్లా లో ఒక టీడీపీ ముసలి కుక్క ఒక అమ్మాయి ని రేప్ చేస్తే ఎక్కడ పప్పు తిని పడుకున్నావ్ గుంటూరు నాగార్జున యూనివర్సిటీ లో ఒక పసి అమ్మాయి చనిపోతే పప్పు తింటూ ఎక్కడ ఉన్నావ్ ..సోళ్లుఆపు పప్పు గా ఇక,1
నిప్పు నాయుడు గారు తప్పు చేశారు... పప్పు నాయుడు ని హై కోర్టు జడ్జి గా చెయ్యవలసింది...ఎవడు ఏమి చేసినా Ysrcpచేసింది అని తీర్పు ఇచ్చేవాడు...ఇంకా ఏ గొడవా ఉండదు మీకు...,1
@naralokesh నీ నోటి నుంచి ఒక్క నిజం కూడా బయటకు రాదా......ఇది చాలా బాధాకరం పప్పు లోకేష్ గారు దయచేసి ట్యూషన్ పెట్టించుకుని నిజాలు మాట్లాడటం నేర్చుకోండి ఇది మీకూ మంచిది ఆంధ్రప్రదేశ్ ప్రజలకు కూడా మంచిది... #APpappu #andhrapappu #CBNLosing2019 https:// twitter.com/naralokesh/sta tus/1099524148538204160 …,1
పప్పు వేషాలు వేశావు అనుకో నీకు పప్పు క్యాన్సల్ చేపిస్తాను menu లో ...ముందు MLA అవ్వు పోయి ...,1
నీకు ఎందుకు ర పప్పు రాజకీయలు పోయి పప్పు తిను,1
అరేయ్ పప్పు నీ కామెడీ ఆపరా బాబు మీ దరిద్రాన్ని చూడలేక చస్తున్నాం https:// twitter.com/naralokesh/sta tus/1099524148538204160 …,1
పబ్లిక్ ని రెచ్చగొట్టి రాజకీయాలు చేయడం లో నీ బాబుని మించిపోయాయేలా వున్నావ్...కొంచెం సేపు YCP & TRS కలిసి ఆంధ్రా మీద యుద్ధం చేస్తున్నారు అంటావ్..మరోసారి BJP & YCP అని రంకెలేస్తావ్...నువ్వు ఎన్ని చేసినా పప్పు ని నిప్పుని ప్రజలు నమ్మేలా లేరు..నిన్ను_నమ్మం_ పప్పు .,1
ఒరేయ్ పిత్రే ... ప్రూఫ్స్ లేకుండా ఇలా పప్పు అని ప్రూవ్ చేసుకుంటావ్ ఏమి,1
పప్పు ఆడవాళ్ళమీద దాడుల గురించి నువ్వే మాట్లాడాలి మహిళలను గుర్రాలతో తొక్కించారు ... వనజాక్షిని ఇసుకలో పడేసి తొక్కారు మర్చిపోయావా ? .. pic.twitter.com/yukM3KAIie,1
పప్పు పప్పు పప్పు పప్పు పప్పు ......,0
తెలంగాణ ల బెంగ పడింది ఎవరో అందరిపై తెలుసు పప్పు లోకేశ్ దమ్ముంటే నువ్వు ఎన్నికల్లో పిటి చేసి గెలువు చూద్దాం,1
ప్రతిపక్ష నేత మీద హత్యాయత్నం చేసి జగన్ చేయించుకున్నాడు అన్న పచ్చ గొర్రెలకి ఇదో లెక్కా....మీరు ఇద్దరూ పొత్తు పెట్టుకోవడానికి డ్రామా బాగా ఆడుతున్నారు...పొత్తు పెట్టుకోవాలంటే పెట్టుకోండి అంతేగాని పిచ్చిపట్టిన కుక్కలా మొరగకండి..నీ పప్పు తెలివి తేటలు మీ పచ్చ గొర్రెలకు చూపించు....,1
సైనికులు వీరా మరణం పొదుతే పప్పు సంబరాలు https://www. facebook.com/10000814756769 6/posts/2335279896753573/ …,1
"పప్పు గారు రావేల గుర్తు తెలియని వ్యక్తులు రాళ్లు విసిరారు అన్నాడు, నువ్వు వై ಸಿ పి కార్యకర్తలు అంటున్నవు, ఇక్కడ ఉన్నది టిడిపి గూండాలు కాదు పప్పు గారు, టిడిపి రౌడీ లు, గూండాలు కాదు పప్పు #RIPYelllowMedia #tdpmukthaandhra #banyellowmedia #andhrapappu #tdpgoondas #yellogoons https:// twitter.com/naralokesh/sta tus/1099524148538204160 …",1
"కెసిఆర్ తో కలిసి పోటీ చేద్దాం అని మీ బాబుగా అడిగాను అని చెప్పాడు,,,అప్పుడు కెసిఆర్ మంచోడేనా???కెసిఆర్ ఎప్పుడైతే నీ దొంగ బాబుని చి నీ బతుకు చెడ అనగానే చెడ్డవాడు అయిపోయాడు?? అంతేనా పప్పు మాలోకం",1
ముడు పార్టి లు కలసి ఒక నాయకుడు మిద టార్గెట్ చేసి మాట్లాడుతూనారు ఆని పప్పు అంటునాడు మరి 2014 లొ ముడు పార్టిలు కలసి జగన్ అన్న మిద పోటీ చెసారు ఆపుడు ఒక్క డు అని గుర్తుకురాలేదా పప్పు,1
"వెన్నుపోటు గాడి ,పేకేజ్ గాడి బంధం ఫెవికాల్ లాంటిది అందుకే చేయని దాడిని వై సి పి కి అంట గట్టి పప్పు గాడు రేట్ట (ట్వీట్) చెయ్యడం మాంసం తింటూ ఎముకలు మెడలో వేసుకొన్నట్టే",1
పప్పు గారికి తన లెవెల్లో డీసెన్సీ రాదనుకుంటా ! వైఛీపీ అనటం స్థాయికి తగ్గట్టు లేదు ! https:// twitter.com/naralokesh/sta tus/1099524148538204160 …,1
పప్పు గాడు లోకేష్ బాబు చెప్పాడా బొల్లి బాబు + బాలయ్య బాబు కు పడేదాకా బాదారు కదారా #NTRMahanayakudu తో #ZeroShareNtrMahanayakudu #ZeroShareMahaNayakudu #ZeroShareBalayya,1
"ఇలాంటివి ఎన్నెన్నో మీ టీడీపీ కూడా చేసింది, అప్పుడు నోరు రాలేదేంటి పప్పు గారు",1
ఒరేయ్ ఎర్రి పువ్వు పంచాయతి సెక్రెటరీ ఎలక్షన్ కి ఎం సంబంధం రా... పప్పు గళ్ళు అందరు టీడీపీ లో...జఫ్ఫా గళ్ళు అందరు వైసీపీ లో ఉన్నారు అనుకుంట.. @TrendPSPK @PasagadaPRASHAD https:// twitter.com/HanuNTR/status /1099195313644920832 …,1
ఒంటరిగా #కోడలిని #తాజ్ హోటల్ కి పంపిన నీచుడు బొల్లోడు అది చూస్తూ తప్పు అని తెలిసికూడా తండ్రికి సపోర్టు చేసిన #నపుంసకుడు పప్పు గాడు. ఈ ఇద్దరూ ఈ రోజు జగన్ గారు 400 రోజులు తరవాత విద్యార్థి అయ్యిన తన కన్న బిడ్డను చూడటానికి లండన్ వెళ్తే దాన్ని కూడా రాజకీయ్యం చేస్తున్నారు... తుపుక్,1
ఏరా నీతి మాలిన ఛంఛలగూడ దొంగ 5RsPaytm సైకో వైఛీఫ్ చిల్లర జఫ్ఫాల్లార జనసేన మహిళాకార్యకర్తలమీద రాళ్ళు వీసరడం ఏందిరా ఏకిళినాయాళ్ళార మీకన్నా పిచ్ఛికుక్కలు నయం. తామేదో పత్తిత్తు ఐనట్టు పంఛయితి పప్పు సానుబూతి చూపడం.,1
గుర్తు తెలుయని వ్యక్తులు దాడి చేశారు అని జనసేన వీర మహిళలే చెప్తుంటే అది వైఎస్సార్ కాంగ్రెస్ పార్టీ పని అని పప్పు లోకేశం సెలవిచ్చాడు. జనసేన - తెలుగుదేశం బంధానికి ఇదొక ఉదాహరణ. ఈమధ్యనే సింగపూర్ లో జనసేన అధినేత కి 2... https://www. facebook.com/10000955044264 2/posts/2189775131350814/ …,1
ఏమయ్యా పప్పు నాయుడు ఇదే ట్వీట్ చింతమనేని చేసిన వ్యాఖ్యల మీద చింతమనేని మీద వేయి చూద్దాం నువ్వు ఎంత మొగోడివో చూస్తాం..... నువ్వు నీ పనికిమాలిన ట్వీట్లు. నీ బ్రతుక్కి ఒక్కటన్నా మంచిపని చేయరా పప్పుగా https:// twitter.com/naralokesh/sta tus/1099524148538204160 …,1
ఇంతకంటే ఏమి నిదర్శనం కావాలి టీడీపీ జనసేన ఒకటే అని. ఈ పప్పు ట్వీట్ వేయడం రవేలకిశోర్ దాన్ని చిరసా వహించడం. ఎవరినీ పిచోళ్ళని చేస్తున్నారు ఇద్దరు కలిసి?? ప్రజలు అంత గమనిస్తున్నారు. రాబోయే కాలం లో ప్రజలు మీ ఇద్దరినీ తరిమి తరిమి కొట్టబోతున్నారు. https:// twitter.com/naralokesh/sta tus/1099524148538204160 …,1
