text,
గుండు కొట్టారు అని వాగడం కాదు రా బోకు ..నీ దగ్గర ప్రూఫ్ ఉందా..అవును మరి బెల్లం కొండ గన్ ఎందుకు పేలింది అంటే దానికి కారణం చెప్పు,1
Next బుల్ బుల్ ఫ్యాన్ అనే ఇంకో రత్నం వస్తుందేమో చూడు.... పిల్లోడికి మంచి విషయాం చెబితే... జాతి రత్నం బురద రత్నం అని బోకు రత్నం లో కామెంట్ చేస్తున్నావ్...,1
మీ బోకు మీడియా వదిలి రియాలిటీ లోకి రా....అర్థం ఐతాది... 3 నెలలు ఆగు....ఆంధ్రప్రదేశ్ ప్రజలు చంద్రబాబు ని చెప్పుతో కోట్టినట్టు సమాధానం ఇస్తారు....అనుమానమే లేదు,1
"బోకు మీడియా C'BOB ని నెత్తిన పెట్టుకున్నా నేషనల్ మీడియాలో గట్టిగా మింగుతున్నారు అయినా సిగ్గా, శరమా మనోడికి దులుపుకు పోవడమే!!",1
"అబ్బో, వచ్చాడండి, సంస్కారం గురించి నేర్పే కుసంస్కారి, వాడి రాజకీయ జీవితం కోసం గోద్రా అల్లర్లని సృష్టించి ఒక వర్గాన్ని ఊచకోత కోయించి ఇంకో వర్గం భావోద్వేగాలని ఓట్లుగా మార్చుకున్న దుర్మార్గుడు ఆ బోడి గాడు, ఈ బోకు గాళ్ళు మళ్ళీ బాబుని వేలెత్తి చూపించడం...థూ..మీ బతుకు.",1
కులభూషణ్ జాదవ్ని ఇండియాకి వచ్చి అక్రమ అరెస్టు చేసి తమ దేశం తీసుకెళ్లి బందీగా పెట్టుకోని బొంకు మాటలు చెప్పే బోకు పాకిస్తానీ గాళ్లు నిజాలు చెప్తారు అని ఎలా అనుకున్నారు వాళ్ల మాటలు నమ్మి మన దేశంలోని వాళ్ళ దేశభక్తి మీద నిందలు వేయటం ఏందో,1
"చూడండి జగన్ మోహన్ రెడ్డి గారు, అక్కడ జరిగింది ఎంటో! గౌరవ ప్రతిపక్ష నాయకుడు అయిన మీరు నిరాదారిత నిందలు వేయడం సబబు కాదు. జరిగింది చూపి ఇది సరి కాదని చెప్తే మే బోకు కుక్కలు మా అమ్మల్ని ఇందులోకి లాగి నీటి మాలిన కామెంట్లు చేస్తున్నారు. ఇప్పుడు వాళ్ళకి మాటలు వర్తిస్తాయి, అది మీ నైజం pic.twitter.com/ONRJmAu0ls",1
"@jaGUN_1974 బెంగళూరు గెస్ట్ హౌసుల్లో హీరోయిన్స్ తో ఎంజాయ్ చేస్తూ, బయటికి శ్రీ రామ చంద్రుడు అని చెప్పుకునే బోకు గాడి కన్నా పవన్ కళ్యాణ్ చాలా బెస్ట్. ఆడవాళ్ళ జీవితాలు నాశనం చేయడం అంటే ""IAS శ్రీ లక్ష్మి"" లాంటి వాళ్ళ ఉద్యోగాలు పోయి కోర్టు ల చుట్టూ తిరుగుతుంటే ఏ నాకొడుకు వల్ల అలా",1
ఇష్టమైన వాడితో పెళ్లి చేస్తాడనే నమ్మకం ఉంటే ఏయ్ కూతురు లేచిపోదు.... 23 MLA పక్కోడితో లేచిపోతుంటే ఈ నాయకుడు పొలంలో గడ్డి పీకుతున్నాడా... లేదంటే బోకు గాళ్ల MLA టికెట్ ఇచ్చాడా...,1
కెనాల్ వర్క్ నువ్వు చూడలేదు. మేము చూసాం. నీ లాంటి బోకు కి అర్ధం అవుతుంది చూపించా. నువ్వు BJP ముసుగు తీసేయ.,1
బోకు ఇయింతడి గోకు అని కవర్ ఉప https:// twitter.com/winsttonxavier /status/1097427294606417920 …,1
"ముందు 2019 లో పోటీ చెయ్యరా వెర్రిపుకా, బోకు లంజాకొడకా",1
మీ పుట్టుక ఎంటో ఊరులో ప్రతి ఒక్కడు చెపుతాడు మీకు ఉన్న బిరుదులు నిజ నిజాలు చెపితే తల ఎక్కడ పెట్టుకోవాలి అర్ధం కాదు. పొరం బోకు న కొడకా. దమ్ము ఉంటే సింగిల్ గా వెళ్లి ఎలక్షన్స్ లో గెలవామను. 2014 లో PK కాలు ఇప్పుడు 2019 లో రాహుల్. మళ్లీ పవన్ తో కలిసిన కలవచ్చు అంటాడు CBN సిగ్గు లేకుండ,1
నలుగురు పెళ్ళాలు అడ్డు!! ఫాంహౌస్ లో బెంగాలీ అమ్మాయిలతో వాడు చేసే పత్తి ఏపారం అడ్డు!! ప్యాకేజీ కోసం ఎలాంటి బోకు గాడికైనా ఊడిగం చేసే వాడి లంచగొండితనం అడ్డు!! సినిమాల్లో ఒక సూపర్ స్టార్ రికార్డు బ్రేక్ చేయకుండా రిటైర్ అయిన నీటిబుడగలాంటి వాడి స్టార్డం అడ్డు!! @This_izz_Me,1
"బాబాయ్ ని ఎవడు తిట్టాడు రా ఇప్పుడు బోకు నా కొడకా, తిట్టింది బొల్లి నా కొడుకుని.. పీక్కో ఏం పీక్కుంటావో",1
చదువు సంస్కారం. ఛత్ బోకు ముం-,1
"అరె ఫోరం బోకు ఎవడు తెలుసులే సంజా కొడుకు,మీరూ కుల గజ్జి గాడిది చీకుతున్నారు కదా రా కూడా వద్దు అన్నప్పుడు ఎక్కడ సచ్చారు,హోదా అంటే జైల్లో పెడుతా అన్నాడుపుడు ల ఎక్కడ పోయారు",1
"అపర బోకు ,మీడియా, 20 కోట్ల రూపాయలు గుజరాత్ ప్రభత్వం టూరిజం మీద వచ్చిన డబ్బులు, మిలాగా, అక్కడ ఏమి లేకున్నా పేపర్స్ ద్వారా,పచ్చ మీడియా ద్వారా మ్యానేజ్ చేసుకుంటారు",1
బోకు నా కొడుకులు కలిసి తీసిన బోకు సినిమా..... pic.twitter.com/YhxCL0HKuW,1
ఏరా బోకు ఇంకా evidenceకావాలా Package కోసం..,1
బొల్లి గాడి సంకనాకినది చాలు బోకు మాదాపూర్స్‌ నీచుడైన బొల్లి గాడి గ్యాంగ్‌ తానా తందాన,1
కాగ్ రిపోర్టు ఉత్తుత్తి నివేదిక.. మీ బోకు ప్రచారం,1
మహామేత mulana ఐఏఎస్లు జైలుకు పోయారు ఇప్పుడు body మూలన ఐపీఎస్లకు గోడకుర్చీ లేయాలి చూస్తుంది కోర్టులో ఇద్దరికీ ఏమీ తేడా లేదు పెద్ద బోకు,1
"నీయవ్వ, బోకు నాయాలా...అదేమాట పావలా గాడ్ని ఒక అమ్మాయి అంటే రచ్చ రచ్చ చేశారు కదరా బెహెన్చోద్... ఇప్పుడు ఫైర్ అంట...రేపు నీ చెల్లినో,అక్కనో ఇంకొకడు 2,3,4 పెళ్లిళ్లు చేస్కుంటా అంటే కూడా ""Aaaatttttttt పావలాదేవ మాస్స్"" అనుకుని సరిపెట్టుకో https:// twitter.com/PowerTollywood /status/1095333572372684800 …",1
"ఒక బోకు ఫెకు గాడితో, ఒక ప్రముఖ సీరియల్ నటీమణి, సర్టిఫికెట్ లేని విద్యావంతురాలు గెస్ట్ హౌస్ లో 2 సంవత్సరాలు కాపురం చేసిందంటగా...ఆడి కిందోళ్లు ఒక లెక్కా...?",1
ఇది చూసిన తరువాత కూడా ఈ బోకు గాడిని పీఎం అనుకుంటే నీ ఖర్మరా సన్నాసి.,1
Avaru cheptaru Anna ee బోకు news meku ...HE IS CONTESTING FROM MYALAVARAM,1
అరే బోకు ..మంచి చేస్తే అందలనికి యెక్కిస్తాం.అదే చెడు చేస్తే అదే అందలం నుంచి తోసివేస్తాం.ఇది ఆంధ్రావాల అంటే..ముందు నీకు నెల్లూరు సీట్ ఇస్తాడో లేదో చూసుకో..,1
బోకు లంజ మోదీ https:// twitter.com/SouthSanghi/st atus/1094654008386560002 …,1
