tag,text,geo,mentions,hashtags,id,permalink
1,#কেরালায় #চাড্ডি #ধোলাই #আরএসএস -এর #চাড্ডিদের সাধারণ মানুষ কুকুদের মতো কেলালো। #সবরীমালা__মন্দিরে কাল #দুজন #মহিলা #প্রবেশ করেছিলেন। আর তার প্রতিবাদে সংঘ পরিবার(RSS) বনধ্ ডেকেছে আজ। সেই বনধের সমর্থন বাইক মিছিল... https://www. facebook.com/OfficialKAZI/v ideos/2214830572170973/ …,,,#ক #চ #ধ #আরএসএস #চ #সবর #দ #মহ #প,1.08084290784486E+018,https://twitter.com/speak2KAZI/status/1080842907844857856
1,#কেরালায় #চাড্ডি #ধোলাই https://www. facebook.com/10000304920857 6/posts/1773638902747733/ …,,,#ক #চ #ধ,1.08081164887986E+018,https://twitter.com/speak2KAZI/status/1080811648879857666
1,কেরালায় চাড্ডি ধোলাই #আরএসএস -এর #চাড্ডিদের সাধারণ মানুষ কুকুদের মতো কেলালো #সবরীমালা__মন্দিরে কাল #দুজন #মহিলা #প্রবেশ করেছিলেন। আর তার প্রতিবাদে সংঘ পরিবার(RSS) বনধ্ ডেকেছে আজ। সেই বনধের সমর্থন বাইক মিছিল বের করেছিল তারা। বাকিটা ভিডিওতে.... https://www. facebook.com/OfficialKAZI/v ideos/2318609668372334/ …,,,#আরএসএস #চ #সবর #দ #মহ #প,1.08080853430715E+018,https://twitter.com/speak2KAZI/status/1080808534307151873
1,সম্মানিও মনমোহন সিংহের পোঁদের চুলের যোগ্য নয় চাড্ডি নরেন্দ্র মোদী। https://www. facebook.com/OfficialKaziMa hammadAsadullaYounus/posts/1773609439417346 …,,,,1.08080481059575E+018,https://twitter.com/speak2KAZI/status/1080804810595749889
1,ঘেসো থেকে চাড্ডি হয়েছে...... ভাগে কম পড়ায়....... pic.twitter.com/hXaZehyqUx,,,,1.07900862693982E+018,https://twitter.com/m_13_10_2000/status/1079008626939817991
1,বেচারা চাড্ডি গুলো। কষ্ট হয়।,,,,1.07795138817532E+018,https://twitter.com/bubka1992/status/1077951388175323136
0,"আহা, মারামারির দরকার কি মশাই? তার চেয়ে মহিলাকে চাড্ডি বাংলা শিখিয়ে দিলেই হয়, আম বাঙালীর মুখে দেখবেন বাংলা ভাষার খই ফুটছে।",,,,1.0777852031023E+018,https://twitter.com/arinbasu/status/1077785203102298112
1,""" যত মত , একই পথ (নিধন) চাড্ডি , ছাগু, গু সবই এক""- রামকৃষ্ণ/. (২৪/১২/২০১৮)",,,,1.07724911889918E+018,https://twitter.com/Azharul27673359/status/1077249118899179520
1,এই হল বিজেপির চাড্ডি দের ন্যাশনালিজম... আর কতো মিথ্যা??? https://www. facebook.com/sudip.basu2/po sts/10218503062837099 …,,,,1.07578770581509E+018,https://twitter.com/sudipdthinker/status/1075787705815089156
1,চাড্ডি দেখলেই ভেঙে দাও চাড্ডি ।,,,,1.07353650821519E+018,https://twitter.com/Dibyendu69/status/1073536508215189506
1,"তাহলে? (রা)ফাল হয়ে ঢুকে শেষে ছুঁচ হয়ে বেরোলো? শালা, সুপ্রীম কোর্টও চাড্ডি হয়ে গ্যাছে।",,,,1.07345740111278E+018,https://twitter.com/Supradip_C/status/1073457401112784896
1,"এখন উপদেশ দিচ্ছি , না শুনলে পরে পাচন হাতে নিয়ে কিভাবে গরুকে শবক শেখাতে হয় ,সেটা আমাদের ভালো ভাবেই জানা আছে ! সুতরাং চুপ চাপ কেটে পর গো- মুত্র সেবনকারী চাড্ডি বাহিনী",,,,1.07326955968626E+018,https://twitter.com/RubelGM78/status/1073269559686258688
1,"৭দিন আগে চাড্ডি : কোথায় গেল সব সেকু মাকু? তেলের দাম কমছে মুখ খোলে না কেন? ৫ রাজ্যের ভোটের রেজাল্টের পরেই তেলের দাম আবার বাড়া শুরু করল। চাড্ডি : হামি গরিব আদমি আছি হুজুর। যে সরকার ভোটে জেতার জন্য তেলের দাম কমাতে পারে, তারা ভোট মিটলেই তেলের দাম বাড়ায় কেন?",,,,1.07315139498557E+018,https://twitter.com/bubka1992/status/1073151394985566208
1,"অহম পু্ত্র গগৈ আজ বাংলার মাটিতে এসে চাড্ডি ভাও মারল,আসলে এটা ছিল এনআরসি তে আসামের বাঙালি খেদাও নিয়ে মমতা ব্যানার্জির প্রতিবাদের বিরুদ্ধে ওর রাগ প্রদর্শন । মনে রাখবেন আসামের বাঙালি খেদাও ইস্যুতে বিজেপি ও কংগ্রেসের অবস্থান কিন্তু এক। যদিও বাংলার বাঘিনীকে ওসব চমকে কোন লাভ-ই হবে না।",,,,1.07288186754259E+018,https://twitter.com/KaPaglu/status/1072881867542585344
1,"কাল থেকে মন্দির বানানো তো দূর, রথ চালানো নিয়েও মুখ খুলছে না। চাড্ডি গুলোর জন্য কষ্ট হয়।",,,,1.07281742921299E+018,https://twitter.com/bubka1992/status/1072817429212991488
1,"চাড্ডি যদি মধ্যপ্রদেশেই ঢিলে হয়ে যায়, তবে আর মানসম্মানের কী বেঁচে রইল? #copied #ArrestKorbenNaPlease",,,#copied #ArrestKorbenNaPlease,1.07253494047721E+018,https://twitter.com/AyaanReus/status/1072534940477206528
1,#AssemblyElections2018 হ্যালো ভক্ত গোমূত্র পিলো পাঁচ রাজ্যের ভোটের ফলাফল দেখার পর ভক্ত ও চাড্ডি দের মনের অবস্তা.... এ কী হল!! কেন হল!! কী যে হল...। আর হা ভক্ত ও চাড্ডি দের বলছি ঠেলাঠেলি করবেন না লাইন ধরে ধিরে সুস্থে আসবেন সবার জন্য বার্নলের ব্যবস্থা করা হয়েছে!,,,#AssemblyElections2018,1.07249885179221E+018,https://twitter.com/EzazHosin/status/1072498851792211968
0,"চাড্ডি ফেটে গেল, আর লোকজন লজ্জা না করে আবার বলছে ? ছিঃ ছিঃ",,,,1.07247107609617E+018,https://twitter.com/Azharul27673359/status/1072471076096172032
1,' চাড্ডি ' খুলে গেল! #VidhanSabhaElectionResults #WaahModijiWaah,,,#VidhanSabhaElectionResults #WaahModijiWaah,1.07245843093229E+018,https://twitter.com/subhojitpatra/status/1072458430932287488
1,অস্ত যাবার মুখে চাড্ডি রা এরকম অনেক কিছুই করবে 2019 এর দিকে তাকিয়ে কোনো লাভ নেই তোলাবাজ দাদা। নিজে সাবধানে থাকো।,,,,1.07240686632664E+018,https://twitter.com/parthagee/status/1072406866326638593
1,না না ওটা বলদের মাংশ। চাড্ডি ভাইরা গরুকে মা বলে। বলদকে বাপ বলেনা। এক্ষেত্রে ওরা খুব উৎসাহ নিয়ে তর্ক করতে এগিয়ে আসে যেহেতু বলদ বাপ নয়। pic.twitter.com/vcXtTiVNCW,,,,1.07178854621252E+018,https://twitter.com/Dibyendu69/status/1071788546212515841
1,"অহে চাড্ডি , বাবর এর ইংরেজি বানান babar নয়, babur. আর তোর ইন্ট্রো তে লেখা কথা টা existentialist, exitentialis নয়৷ Jai shree rum.",,,,1.07095947804721E+018,https://twitter.com/cannot_connect/status/1070959478047211520
1,আমি গরিব চাড্ডি আছি বাবু। কুনজর দিবেন না।,,,,1.06817797779861E+018,https://twitter.com/ranajit_das365/status/1068177977798610949
1,লাল পতাকার মিছিল দেখে সব থেকে বেশি জ্বলছে চাড্ডি গুলোর। বেচারারা আশায় ছিল বাংলায় কিছু করবে। চাষী গুলো এরকম বাঁশ দেবে বোঝে নি। #SingurKisanMarch,,,#SingurKisanMarch,1.06790488224016E+018,https://twitter.com/bubka1992/status/1067904882240155648
1,"নাসা মঙ্গল গ্রহে রোবট পাঠানোর জন্য সেলিব্রেশন করছে । এই রোবট মঙ্গল গ্রহে কি আছে না আছে খুঁজবে আর ভরতে বিজেপির দাঙ্গাবাজরা এবং চাড্ডি গ্যাং গরুর পিছনে মুসলিম খুঁজে বেড়াচ্ছে, পিটিয়ে মারার জন্য । পিটিয়ে মেরে সেলিব্রেশন করে",,,,1.06737662702835E+018,https://twitter.com/SarifAishwaria/status/1067376627028348928
1,দালালের ভাষায় কথা বলতে কি চাড্ডি বাহিনীর আনুগত্যের ফল.. তাহলে বলে রাখি সোশ্যাল মিডিয়াতে লেকচারবাজি না করে সামনে এসে দাঁড়িয়ে দুটো কথা সাজিয়ে বলার ক্ষমতা আছে কিনা দেখিনি.. দু লাইন বাংলা লিখতে তাও আবার ইংরেজি alphabets এ এই দশা.. আবার বড় বুকনি !!,,,,1.06623698544933E+018,https://twitter.com/saheli2016/status/1066236985449332737
1,Joydeep Dehumanized Roy শেষ মাও টাও চাড্ডি হয়ে গেল?? https:// kolkata24x7.com/kerala-govt-wi ll-lounch-new-scheme-for-dairy-farmers.html …,,,,1.06343596002796E+018,https://twitter.com/SUPRAVAT_WBBJP/status/1063435960027963393
1,"And the winner is .... ভো ভো অকালপক্ক সুকুমারমতি মাকু ও সেকু বালক বালিকাগণ, আপনাদের অবগতির জন্য জানাইতেছি যে আপনারা যতই ভাজপা নামক একটি রাজনৈতিক দলের কার্য্য কর্তাদের "" চাড্ডি "" বলিয়া উপহাস করুন অথবা তাহাদিগের... https://www. facebook.com/12824568385721 0/posts/2403192699695819/ …",,,,1.06178199372422E+018,https://twitter.com/rup_khn/status/1061781993724219392
1,""" চাড্ডি দেখিলে পথে, ক্যালাইবে বিধিমতে..."" pic.twitter.com/wUytKxuoQM",,,,1.06161628688135E+018,https://twitter.com/iamroysunny/status/1061616286881349632
1,"সত্যি, নাটক চাড্ডি করতে পারেন মোদী জি।",,,,1.06009485750546E+018,https://twitter.com/JYOTIPRAKASLOVE/status/1060094857505456128
1,চাড্ডি পার্টি সদস্য হতে গেলে ধর্মে অন্ধ হতে লাগে আর বাম হতে গেলে শিক্ষা লাগে,,,,1.05964527822179E+018,https://twitter.com/iamroysunny/status/1059645278221791232
0,জুতো কিনে ফিলিং অসাম ফেসবুকের দৌলতে আর কতো কিসের যে আপডেট দেখতে হবে!!! ভাই তোরা চাড্ডি কিনেও স্ট্যেটাস দিতে পারিস তো।,,,,1.05939440199314E+018,https://twitter.com/IAmMrSubhojit/status/1059394401993142273
1,"আমি অনেকের সঙ্গেই কথা বলেছি। মুসলিম,হিন্দু, সেকু, মাকু, চাড্ডি , টিনু। সবাই এক কথাই বলছে। রাম মন্দির টা যত তাড়াতাড়ি হয়ে যায় তত ভাল। সমস্যা হল রাম মন্দিরটা হয়ে গেলে প্রতি বছর ভোটের আগে এই চুলকানিগুলো তখন আর কেউ... https://www. facebook.com/EtoChudurbudur Keno/posts/1348879838582742 …",,,,1.05894551690881E+018,https://twitter.com/ECbKOFFICIAL/status/1058945516908806144
0,"আমার ফেসবুক বন্ধু তালিকায় শাহরুখ খানের ভক্ত প্রচুর।শাহরুখ নিয়ে তারা প্রায় ফ্যানাটিক। মানে ফেসবুকে মোদি ভক্ত হিন্দুবীরদের যেমন আমরা মজা করে চাড্ডি বলে ডাকি, তাদেরকেও শাহরুখচাড্ডি বলা যায়।শাহরুখকে তারা ঠিক একজন... https://www. facebook.com/12824568385721 0/posts/2389981504350272/ …",,,,1.0586806590179E+018,https://twitter.com/rup_khn/status/1058680659017900035
0,দেখো বাছা হাসতে গিয়ে আবার চাড্ডি না খুলে যায় ।,,,,1.0586662239725E+018,https://twitter.com/AmitSen65493589/status/1058666223972495360
1,"চাড্ডি দেখিলে পথে, সেঁকে দিয়ো বিধিমতে! https:// twitter.com/Dibyendu69/sta tus/1057837104984555520 …",,,,1.05783903485092E+018,https://twitter.com/Dibyendu69/status/1057839034850918400
0,অস্ত্র ব্যবহারের সময় শরীরে বস্ত্র থাকতে হবে এমন কোনো কথা সংবিধানে নেই!! (জয়তু চাড্ডি লীগ!! pic.twitter.com/hTpVbx2zrt,,,,1.05637340171827E+018,https://twitter.com/Borhan_sorkar/status/1056373401718267904
1,"তিনতালাক নিয়ে কোনো চাড্ডি কথা বলতে এলে পাল্টা শবরিমালা নিয়ে প্রশ্ন করুন !! ভারতবর্ষে নারী অধিকার প্রতিষ্ঠা তিনতালাক বন্ধ করে শুধু হবে না, শবরিমালায় যে কোনো বয়সের নারীদের প্রবেশ সুনিশ্চিত করার মাধ্যমে হবে !!",,,,1.0561266760931E+018,https://twitter.com/arisaying/status/1056126676093095936
1,সবরিমালায় পাথর ছুড়তে যাওয়া চাড্ডিদের তারা করেছে পুলিশ। এই দৃশ্য গুলো দেখব বলেই তো বেঁচে থাকা। আহা। এখনো অবধি 1407টা চাড্ডি জেলে। পুরো চুমু।,,,,1.05570146165973E+018,https://twitter.com/bubka1992/status/1055701461659725824
1,"আজ থেকে মাকু, সেকু, চাড্ডি , সরাকারি হারামখুর, সব্বার অফিস খুলে যাচ্ছে। ফেসবুক আবার শান্ত হবে",,,,1.05569126149413E+018,https://twitter.com/AnindyaBiswas4/status/1055691261494132736
1,যারা চাড্ডি নিয়ে রাজ্যে লাফাচ্ছে তাদের উদ্দ্যেশ্যে আগে ডায়াপার পড়া শেখ তার পড় ওই পড়ে লাফাবি...,,,,1.05553576230793E+018,https://twitter.com/iamroysunny/status/1055535762307932160
1,"একটি বিশেষ ঘোষনা- চাড্ডি পার্টির, তেলে ভাজা পার্টির সদস্যরা দয়া করে আমাকে Friend request পাঠিয়ে আমাকে বিব্রত করবেন না - আবালদের Friend request Accept করি না উল্টেই Request পাঠিয়ে বাদুরের মতো ঝুলে থাকবেন.. @Amartya_asn_09",,@Amartya_asn_09,,1.05552109316584E+018,https://twitter.com/iamroysunny/status/1055521093165842432
1,"বাওয়ালের ছবি দেখে, ফেসবুক একাউন্ট খুঁজে, ঠিকানা বার করে সবরিমালাতে মেয়েদের আটকাতে আসা চাড্ডি গুলো কে ধরছে। বিজেপি কি যে ভুল করল সুপ্রিম কোর্টের অর্ডারের পরেও কেরালা গভর্মেন্ট কে ঘটিয়ে, ওরা নিজেও জানে না। মেথোডিকালী বিজেপি শেষ হবে এবার কেরালা তে। কেরালা গভর্মেন্ট, take",,,,1.05548430745884E+018,https://twitter.com/bubka1992/status/1055484307458842624
0,"আহা... এতো উতলা হবার কি আছে!? আমার কাছে এখন অফুরন্ত সময়। মেনশন যখন পেয়েছি ইহাতে দুচারটে কথা না বললে তো রাতের ঘুমটাও ঠিক মত হবে না। প্রথমেই একটা লিমেরিক দিয়ে শুরু করি, ""সকাল হৈতে এখনো অনেক দেরী, কাউয়া কহে, এইতো সুযোগ... চাড্ডি টানি ধরি!!"";;;;""1054488430653124609",https://twitter.com/tirthar_kak/status/1054488430653124609,,,,
1,"কেরালা সরকার সবরীমালা মন্দির সব বয়সী মহিলাদের জন্য আদালতের নির্দেশ সাপেক্ষে অবাধ প্রবেশাধিকার জারি করেছে . চাড্ডি রা বিরোধীতা করছে , পাশাপাশি চাড্ডি দের হাড্ডি ভাঙাও চলছে .",,,,1.05247461856763E+018,https://twitter.com/Sumanbunty/status/1052474618567626752
1,আমাদের পাড়ায় ভারতের কিছু কুলাঙ্গার( চাড্ডি ) বই নিয়ে বসেছে...আবালগুলোও পড়াশুনো করে নাকি @Dibyendu69 @Amartya_asn_09 @RaktimArnav @iamadwoy pic.twitter.com/weXsYE7YZ8 – bei Sher-e-Punjab,,@Dibyendu69 @Amartya_asn_09 @RaktimArnav @iamadwoy,,1.05221409036441E+018,https://twitter.com/iamroysunny/status/1052214090364411904
1,"একজন কুত্তা চাড্ডি নিজেদের পোল খুলে দিল।চাড্ডিবাদী, হাম্বাবাদী, গো-বাদী অন্ধ ভক্তের দলের কুকরগুলোকে শেয়ার করে দেখিয়ে দিন, কুত্তা মোদী কি করেছে। Share করুন। https://www. facebook.com/OfficialKAZI/v ideos/744359192581613/ …",,,,1.0518540554867E+018,https://twitter.com/speak2KAZI/status/1051854055486701568
0,"গফরে জিগাইয়া কিত্ত, কাজের মাইয়ার রুমে দেখলাম আপনার চাড্ডি",,,,1.05153363991223E+018,https://twitter.com/boozy_me/status/1051533639912226816
1,জয়গুরু। চাড্ডি দের কথা শুনুন। https://www. facebook.com/story.php?stor y_fbid=10218009753944685&id=1510994403 …,,,,1.0512990643594E+018,https://twitter.com/sudipdthinker/status/1051299064359395328
1,এরকম অন্তত 100 টা ছবি আমরা পোস্ট করতে পারবো। চাড্ডি তোরা কটা পারবি???? pic.twitter.com/AvupYIauIc,,,,1.05108769675041E+018,https://twitter.com/70chatterjee/status/1051087696750411776
0,চাড্ডি কি জিনিস ভাই?ঘুষি?তাইলে তোমার ধারনা ঠিক!,,,,1.05099667363417E+018,https://twitter.com/mithila__/status/1050996673634168833
0,আমার মাথায়ও চুল কম! তুইতো আমারে চাড্ডি মারবি ফর শিউর!,,,,1.05099640206553E+018,https://twitter.com/akib_66/status/1050996402065526784
1,"বাংলাদেশি কিছু চাড্ডি দিয়ে ফেসবুক পোষ্ট কমেন্ট বিজেপির হয়ে সাজানো যায়, রাজ্যে বিজেপির পাতা নাই, ভাগ চাড্ডি ভাগ.. pic.twitter.com/xBfMSJZAyv",,,,1.05098021582712E+018,https://twitter.com/70chatterjee/status/1050980215827116032
1,দুর্গা পুজায় আমিষ খান। হাতের কাছে কিছু না পেলে এক'আধখান চাড্ডি ধরে মায়ের কাছে বলি দিয়ে খান। মা বড্ড সন্তুষ্ট হবেন।,,,,1.05073204268044E+018,https://twitter.com/kingshukmondal/status/1050732042680438784
1,গঙ্গা বাঁচাতে গিয়ে শহীদ হন জিডি আগরওয়াল এর মতো অধ্যাপক আর গঙ্গার নামে পকেট ভরান সংসদ চৌকিদার। আবার নিজেকে গঙ্গার পুত্র বলে দাবি করেন?? চিনে নিন গঙ্গার আসল পুত্র কে আগরওয়াল না দাঙ্গাখোর চাড্ডি,,,,1.05051921263091E+018,https://twitter.com/sudipdthinker/status/1050519212630913024
0,"ছড়া, কবিতা, গান, লিরিক্স, সুর, পেন্টিং... চাড্ডি খানি কতা। স্যালুট ভাই!",,,,1.0497244087163E+018,https://twitter.com/paulsajal/status/1049724408716296192
1,"এই গোরুর বাচ্চা! তুই নোবেল মানে জানিস! এত বড় একজন মানুষ! এই যে দাদা, সকাল সকাল মাথা গরম করছেন কেন? আর বলবেন না স্যার, এই গোরুর বাচ্চা বলে কিনা অমর্ত্য সেন দেশের জন্য কি করেছে! চাড্ডি যাকে বলে! মাথাটা চট... https://www. facebook.com/10001397266714 1/posts/510420739433677/ …",,,,1.04966871909235E+018,https://twitter.com/samratkgp2016/status/1049668719092350976
