tag,text,geo,mentions,hashtags,id,permalink
1,শালা বিজেপি চাড্ডি আঁটিশেল মানেই মেয়ে কেশে জরিত। লাথি মারি ওদের মুখে। এই মহিলার মতো ওদের দেখলেই জুতা পেটা করা উচিৎ https://www. facebook.com/LaalFouz/video s/266656020937643/ …,,,,1.10807686110665E+018,https://twitter.com/LaalFouz/status/1108076861106647043
0,"এক ভৌমিক চামচা এইমাত্র আমাকে কল করে বোঝাতে চেষ্টা করলো দলের প্রতি তার কত অশেষ অবদান আর কৃপা আর সেই সাথে বহুরূপী ভৌমিকের! তাকে একটা কথাই বললাম, সে যখন হাত ছাপ চাড্ডি পড়তো তখন থেকেই আমি গেরুয়া। চামচাগিরি করে আমার কাছে কোনো লাভ হবেনা।",,,,1.10804016684784E+018,https://twitter.com/TheUltimateDD13/status/1108040166847840256
0,PUBG খেলা বন্ধ কখন করছে চাড্ডি গন? #BoycottChineseProducts,,,#BoycottChineseProducts,1.10613768261334E+018,https://twitter.com/bubka1992/status/1106137682613338112
1,একমাত্র চাড্ডি রাই 'মোল্লা' দের খবর রাখে।,,,,1.10588123310645E+018,https://twitter.com/deba6616/status/1105881233106452482
1,#চাড্ডি __যুগের__শেষের__শুরু #অমিত__শাহের__সভাতে__ঝামেলা__ভাঙচুরের__জেরে #সভা__ছেড়ে__চলে__গেল__অমিত__শাহ । বিজেপি কর্মী ও নেতাদের মধ্যে মারামারি এবং ভাঙচুর করা হলো চেয়ার #মহিলা__কর্মীকে জোর করে সভা থেকে বের করে দেওয়া হলো। https://www. facebook.com/47543702253626 2/posts/2074077489338866/ …,,,#চ #অম #সভ #মহ,1.10444063940665E+018,https://twitter.com/speak2KAZI/status/1104440639406649344
1,সারা পৃথিবীতে ছড়িয়ে গেল জুতো পেটা আর এই আঁটিশেল চাড্ডি কি বলছে বিরোধী চক্রান্ত। কেউ হাসবেন না প্লিজ https://www. facebook.com/LaalFouz/video s/562296697588334/ …,,,,1.10392481360359E+018,https://twitter.com/LaalFouz/status/1103924813603594240
1,উত্তরপ্রদেশের রাস্তায় দুই #কাশ্মীরি___ফলবিক্রেতাকে অমানবিক ভাবে মারধর করলো #গেরুয়া__সন্ত্রাসবাদী__সংগঠনের__সদস্যরা । তারা #আরএসএস (RSS) গোষ্ঠীর লোক বলে জানা গেছে। চাড্ডি মুখ্যমন্ত্রী #ডগি_আদিত্যানাথ বসে বসে গরুর মূত্র পান করছে। https://www. facebook.com/OfficialKAZI/v ideos/1871123409658318/ …,,,#ক #গ #আরএসএস #ডগ,1.10357839539545E+018,https://twitter.com/speak2KAZI/status/1103578395395452928
1,এবার চাড্ডি আঁটিশেল দেখলেই শক্ত কাঁচা বাঁশের ডান্ডা নিয়ে কে** শুরু হোক গেরুয়া গুন্ডাগুলো নিরীহ ফল বিক্রেতাকে আক্রমণ করে নিজেদের হিরো ভাবছে। আশেপাশের লোকজনের শুভবুদ্ধি না থাকলে কী হত বলা যায়না। আবারো ভাবুন। এই দেশটাই আমরা চেয়েছিলাম তো? https://www. facebook.com/LaalFouz/video s/400662750667029/ …,,,,1.10336739801346E+018,https://twitter.com/LaalFouz/status/1103367398013456389
1,উনি চিরহরিৎ ঘাসফুলের ঝোপ এটা মেনে নিয়েও যে প্রশ্নটা উপরে করা হ'ল তার জবাব চাড্ডি জনতা দাবী করছে।,,,,1.10299552400373E+018,https://twitter.com/SreejitDatta/status/1102995524003733504
1,"ভারতের চাড্ডিরা রাম রাজত্ব চায় এতে অবাক হওয়ার কী আছে? চাড্ডি তো এরকমই চাইবে। সব চাড্ডি চাইছে না এটাই বরং অবাক হওয়ার বিষয়। কিন্তু জনাব, ভারতের কমিউনিস্টরা কোন লজিকে তিন তালাক চায়? চার বিয়ে চায়? মুসলমানেরা... https://www. facebook.com/jupiter.joypra kash/posts/2087076094692511 …",,,,1.1029396174421E+018,https://twitter.com/JupJoyprakash/status/1102939617442099205
1,বিজেপি ভক্তদের ভক্তি বিপদের মধ্যে আছে দেখেনিন একদা গান্ডু চাড্ডি ভক্তরা কি বলছে https://www. facebook.com/LaalFouz/video s/2277583879228524/ …,,,,1.10288930382122E+018,https://twitter.com/LaalFouz/status/1102889303821217793
1,"[বায়ুসেনা প্রধান প্রেস কনফারেন্স করে জানালেন,""টার্গেটে আঘাত করা হয়েছে। কতজন মারা গেছে, সেটা গুনতি করা আমাদের কাজ নয়।""] ঠিকই বলেছেন স্যর, গুণতি করাটা চাড্ডি মোদীমিডিয়ার কাজ। কয়েকদিন ধরে ওরা শুধু গুণে চলেছে। বিস্তারে পড়ুনঃ https://www. facebook.com/23291957973303 27/posts/2336956853220888/?app=fbl … pic.twitter.com/iAJwmtRnCX",,,,1.10262254154003E+018,https://twitter.com/THEUPDATENEWSs/status/1102622541540028416
1,পুলওয়ামা কান্ডের পর চাড্ডি আর মিডিয়ার যৌথ উদ্দ্যোগে যে ভাব গুজব ছড়িয়েছে তা এক নিদর্শন হয়ে থাকবে। এ ঘটনার কারা তা জানা আগে জরুরী।,,,,1.10244792362997E+018,https://twitter.com/SaidulI68754680/status/1102447923629969409
1,দেখুন ওরা বিজেপির পতাকা নিয়ে কি মিছিল বের করলে? পাকিস্তান মুর্দাবাদের সাথে সাথে #IndianArmy কে স্লোগান দিলো #মুর্দাবাদের । এই আঁটিশেল চাড্ডি #RSS #দেশদ্রোহী #BJP দেশের মধ্যে যাখুশী তাই শুরু করে দিয়েছে। শুরু হোক এই... https://www. facebook.com/LaalFouz/video s/814108118923768/ …,,,#IndianArmy #ম #RSS #দ #BJP,1.10242832706585E+018,https://twitter.com/LaalFouz/status/1102428327065853953
0,"আজ শিবরাত্রি, আজ দুধের অপচয় নিয়ে জ্ঞান দেবার দিন! কিন্তু দুধের উৎস গোরক্ষার কথা বললে তুমি সাম্প্রদায়িক, তুমি চাড্ডি , তুমি ভক্ত, তুমি গোসন্তান!",,,,1.10240966333584E+018,https://twitter.com/DebasisMistri/status/1102409663335841792
1,দেখুন আঁটিশেল চাড্ডি দেশদ্রোহী মালগুলো সেনাদের নিয়ে কিরকম রাজনীতি করে ভোট চাইছে https://www. aajkaal.in/news/title/bjp -mp-in-army-s-dress-ok1d …,,,,1.1024081768911E+018,https://twitter.com/LaalFouz/status/1102408176891097091
0,"পাক অধিকৃত কাশ্মীরের বিমান হানার যাবতীয় তথ্য দাবি করেছে বিরোধীরা। তৃণমূল সাংসদ ডেরেক দাবিকরেছেন শহিদদের নিয়ে রাজনীতিকরার অধিকারই মোদি ও অমিতশাহের নেই।যাঁরা স্বাধীতা আন্দোলনের সময় টেবিলের তলায় লুকিয়ে কাটিয়েছেন, সেই ‘‌খাঁকি– চাড্ডি ’‌ পরা লোকেদের মুখে দেশপ্রেমের কথা মানায় না। pic.twitter.com/DAbozfLsC4",,,,1.10225984475977E+018,https://twitter.com/MukulAdhikary5/status/1102259844759773185
0,"পুলওয়ামা হামলার পর থেকেই সেনাবাহিনীকে নিয়ে রাজনীতি করছেন মোদি এবং অমিত শাহ। টুইটে ডেরেক স্যার, লিখেছেন যাঁরা স্বাধীতা আন্দোলনের সময় টেবিলের তলায় লুকিয়ে কাটিয়েছেন, সেই ‘‌খাঁকি– চাড্ডি ’‌ পরা লোকেদের মুখে দেশপ্রেমের কথা মানায় না। @derekobrienmp @ThePrincePathak @AITCofficial pic.twitter.com/yvojNwamRp",,@derekobrienmp @ThePrincePathak @AITCofficial,,1.10225938083617E+018,https://twitter.com/SarkarGopen/status/1102259380836167680
1,"মোদির চাপে যদি অভিনন্দন ফেরত আসে, নিরব মোদি, বিজয় মালিয়া, লোলিত মোদিরা দেশে ফেরত আসেনা কেন? চাড্ডা চাড্ডি জবাব চাই",,,,1.10204901225607E+018,https://twitter.com/MDSADIDUL/status/1102049012256067584
1,বিজেপি আঁটিশেল চাড্ডি দেখলেই একগ্লাস গোমূত্র শ্রদ্ধার সাথে খাওয়াবেন। না খেলে জোর করে গলায় পা দিয়ে খাওয়াবেন। তার পর ঐ দেশদ্রোহী কে জিগেস করুন সেনাবাহিনী নিয়ে কেন হারামজাদা গুলো ভোটের রাজনীতি করছে। যেমন মুদি তেমন তার চামচা। পুরোপুরি গল্প দিয়ে দিলো!... https:// thewall.in/news-national- bjp-mp-says-we-didnt-want-any-damage-in-balakot/ …,,,,1.10180132941495E+018,https://twitter.com/LaalFouz/status/1101801329414950918
1,"মোদির চাপে যদি অভিনন্দন ফেরত আসে, তবে নিরব মোদি, বিজয় মালিয়া, লোলিত মোদিরা দেশে ফেরত আসেনা কেন? চাড্ডা চাড্ডি জবাব চাই",,,,1.10155287769112E+018,https://twitter.com/samsujjaman358/status/1101552877691121667
1,মানুষ এখন এই আঁটিশেল চাড্ডি দেখলেই হাসা হাসি করছে #GoBackModi https://www. facebook.com/LaalFouz/video s/649888672113761/ …,,,#GoBackModi,1.10142583720987E+018,https://twitter.com/LaalFouz/status/1101425837209874432
1,এই #আঁটিশেল #চাড্ডি #RSS #BJP র গোপন মিশন দেখুন। এরা তো সত্যিই #দেশদ্রোহিতার -ও চরম শিখরে। এদের কে নিয়ে এক অংশের অবুঝ গো-মুত খোর চাড্ডি মোদীর চামচাগুলো লাফালাফি করছে? ২০১৯ এ আবার এদের ভোট দিয়ে আনবেন না কি? মাথা খারাপ? #দু_হাজার_ঊনিশ_বিজেপি_ফিনিশ https://www. facebook.com/LaalFouz/video s/2075553655872605/ …,,,#আ #চ #RSS #BJP #দ #দ,1.10122117102507E+018,https://twitter.com/LaalFouz/status/1101221171025068032
0,আচ্ছা বেটা ফেকুখোর চাড্ডি,,,,1.10116800512635E+018,https://twitter.com/Amartya_13/status/1101168005126348800
1,সোসাল মিডিয়ায় চাড্ডি দেখতে পেলেই সঙ্গে সঙ্গে ব্লক করুন বন্ধু,,,,1.10112416033036E+018,https://twitter.com/baghumama/status/1101124160330362880
0,"'ভিক্ষা চাইনা কুত্তা সামলা' টোনে বিজেপি এবং মোদির ম্যাচো ইলেকশন ক্যাম্পেইন শেষ হতে যাচ্ছে। আপাতত প্রতিশোধ বাধ দিয়ে, পাকিস্তানি বদান্যতায়, উইং কমান্ডার অভিনন্দন কে ফেরৎ নিয়ে নিজেদের বিজয় র‍্যালি চালাতে হবে মোদি আর তার চাড্ডি ভক্তদের।",,,,1.10109094010884E+018,https://twitter.com/sarwar_emon/status/1101090940108840960
1,শুধু জানে চাড্ডি ভক্তবৃন্দ আর... https:// m.huffingtonpost.in/entry/defence- ministry-says-no-information-on-indian-aircraft-violating-pakistani-airspace_in_5c74bca9e4b02efbde1d93c3?ncid=fcbklnkinhpmg00000001&fbclid=IwAR0ElHFC7hVnTf7Yd8NZ57wi_rD5QLyH_J5b5-vdfO9T5jpvN8SQzS0lLCo …,,,,1.10027298333396E+018,https://twitter.com/sat8085/status/1100272983333957633
1,"ভারতবর্ষে কার্নী সেনা , শিব সেনা, হনুমান সেনা , চাড্ডি সেনা এসব ভোট-দাঙ্গা-লুটের সেনা। আসল সেনা তো ভারতীয় সেনা #SaluteIndianArmy",,,#SaluteIndianArmy,1.10026278747608E+018,https://twitter.com/Dibyendu69/status/1100262787476082688
1,"ভারতবর্ষে কার্নী সেনা , শিব সেনা, হনুমান সেনা , চাড্ডি সেনা এসব ভোট-দাঙ্গা-লুটের সেনা। আসল সেনা তো ভারতীয় সেনা #SaluteIndianArmy https://www. facebook.com/LaalFouz/video s/719485378446110/ …",,,#SaluteIndianArmy,1.10025831516934E+018,https://twitter.com/LaalFouz/status/1100258315169341440
0,"কেউ কেউ পাকিস্তানকে বাঁচাতে এতটাই ততপর, যারা দেশের হয়ে কথা বলছে, তাদের চাড্ডি বলে টেগিয়ে দিচ্ছে।",,,,1.10003279438903E+018,https://twitter.com/paulsajal/status/1100032794389032961
1,মানুষ হচ্ছে বিরোধীরা ।যে অস্ত্রে হনুরা সব্বাইকে ঘায়েল করে সেই অস্ত্রে শান দিচ্ছে বিরোধীরা ।জনৈক আরএসএস বিশুদ্ধানন্দের নামাঙ্কিত ফেকপ্রোফাইল।একের পর এক চাড্ডি সুলভ শক্তিশেল ছুঁড়ছে ।আজ আরও একটা ব্রম্মাস্ত্র... https://www. facebook.com/bengalpolitics /posts/2561969123818175 …,,,,1.09888140561714E+018,https://twitter.com/rup_khn/status/1098881405617143808
1,"এমনিতে আমি অহিংস প্রকৃতির ছেলে, তবে একটা কথা না বলে পারলাম না! কুকুর বেড়াল মেরোনা, চাড্ডি পেলে ছেড়োনা।",,,,1.09862996675169E+018,https://twitter.com/AnishAhmed007/status/1098629966751686656
1,#আরএসএস থেকে জন্ম হওয়া #বিজেপির_ চাড্ডি _নেতা_বীর_শহীদদের শেষ শ্রদ্ধা জানাচ্ছিল #জুতো _পরে। #জনগণ_মারমুখী হয় উঠলে #ভয়ে_জুতো_খুলতে_বাধ্য‍ হয়। এদের কাছে শিখবেন #দেশভক্তির বানী! https://www. facebook.com/OfficialKAZI/v ideos/2257502494568391/ …,,,#আরএসএস #ব #জ #জনগণ_ম #ভয #দ,1.09814164323085E+018,https://twitter.com/speak2KAZI/status/1098141643230851073
1,সব দেশদ্রোহী চাড্ডি নয়। কিন্তু সব চাড্ডি দেশদ্রোহী । #Collected,,,#Collected,1.0978419724029E+018,https://twitter.com/nandan1971/status/1097841972402900992
1,"#উত্তরপ্রদেশের__আরএসএস (RSS)-এর #চাড্ডি যুব নেতা #বোরখা পরে #মহিলা__শৌচালয়ে উঁকিঝুকি মারতে গিয়ে ধরা পড়লো, তারপর #গণধোলাই । #শেয়ার করে #দেশভক্ত__চাড্ডিদের আসল রূপ সবার সামনে আনুন। https://www. facebook.com/OfficialKAZI/v ideos/2087343561354015/ …",,,#উত #চ #ব #মহ #গণধ #শ #দ,1.09782151983997E+018,https://twitter.com/speak2KAZI/status/1097821519839969280
1,"মমতা ব্যানার্জীর বক্তব্য বিকৃত করে একটি বাজারী পত্রিকার ট্যাবলয়েড ছেপেছে, আর সেটা নিয়ে চাড্ডি আর মাকুরা মহা উৎসাহে মিম বানিয়ে কুৎসা করতে লেগেছে। এদের উচিত চরাম চরাম ঢাক বাজানো। আসল খবর জানুন ও সবাইকে শেয়ার করে জানান । #TMCS All India Trinamool Congress",,,#TMCS,1.09695219452653E+018,https://twitter.com/TMC_Supporters/status/1096952194526527488
1,"মমতা ব্যানার্জীর বক্তব্য বিকৃত করে একটি বাজারী পত্রিকার ট্যাবলয়েড ছেপেছে, আর সেটা নিয়ে চাড্ডি আর মাকুরা মহা উৎসাহে মিম বানিয়ে কুৎসা করতে লেগেছে। এদের উচিত চরাম চরাম ঢাক বাজানো। আসল খবর জানুন ও সবাইকে শেয়ার করে জানান । #TMCS",,,#TMCS,1.09695218843225E+018,https://twitter.com/TMC_Supporters/status/1096952188432252928
1,"এই তো সময় চাড্ডি পরে, কাধে লাঠি নিয়ে দেশের বর্ডারে যাওয়ার... https:// in.news.yahoo.com/video/rss-depl oy-solders-faster-indian-083500805.html?soc_src=social-sh&soc_trk=fb …",,,,1.09677545243646E+018,https://twitter.com/mazumderw/status/1096775452436455424
0,"পোলাপান পোলাপান কইয়া কানারে মাথায় উঠাইয়া রাখছো,, যাক তুমি যখন কইছো তাহলে এই শীতের রাতে ওর চাড্ডি গিলা করলাম না আর",,,,1.09654708392925E+018,https://twitter.com/boozy_me/status/1096547083929247745
1,"হেবি কায়দা তো! চাড্ডি , 'প্রগতি' মিলেমিশে একাকার।",,,,1.09631310887071E+018,https://twitter.com/sat8085/status/1096313108870713344
1,অখিলেশ যাদবকে কেন এলাহাবাদ যেতে দেওয়া হল না দাঙ্গাবাজ দিলু কাকুর দল এবং ইংরেজ দের অবৈধ বংশধর চাড্ডি গ্যাং জবাব দিন। এই ধরনের ঘটনা বাংলায় ঘটলে তো ভারতের সমস্ত রাজ্যে ইংরেজ দের অবৈধ বংশধর চাড্ডি গ্যাং মরা কান্না... https://www. facebook.com/10000953305174 1/posts/2214169592244121/ …,,,,1.0955327122896E+018,https://twitter.com/sekh_hasanur/status/1095532712289595392
0,"আপনেও খালি মাঠে গোল দেয়া শিখিয়ালচেন, বিয়াই আসলে আপনি তখন চাড্ডি খুজে পাবেন না",,,,1.09454683504841E+018,https://twitter.com/Pagolmon_/status/1094546835048407040
0,"বেশ কিছুদিন দেরী হল। কিন্তু দেখতে যাওয়াটা কর্তব্য ছিল। কারণ স্ক্রল যখন বলেছে সিনেমাটা টক্সিক হাইপার ন্যাশ্নালিজম প্রোমোট করছে, তখন চাড্ডি হিসেবে সিনেমাটা হলে গিয়ে, হ্যাঁ, হলে গিয়ে দেখাটা ছিল অবশ্য কর্তব্য। দাউদ... https://www. facebook.com/10000022849460 3/posts/2987751141242473/ …",,,,1.09174642697402E+018,https://twitter.com/Supradip_C/status/1091746426974019585
0,"ভবিষ্যতের জন্য এক্টা আউডিয়া দিয়ে দেই, যদি কখনো আবার এমন বিপদের সম্মুখীন হন!! তাহলে চাড্ডি খুলে টিসু বানিয়ে ব্যাবহার করে নিয়েন",,,,1.08985211512676E+018,https://twitter.com/boozy_me/status/1089852115126755331
1,"বাংলাটা আবার কে লিখে দিলো? বানান ভূল চাড্ডি খানেক ২০১৯এর নতুন গান শুনুন... হরে কৃষ্ণ, হরে রাম ভাঁওতা দেওয়াই মোদির কাম https:// twitter.com/KailashOnline/ status/1088391516228341760 …",,,,1.08840860647354E+018,https://twitter.com/M4TMC/status/1088408606473543680
0,"সুপারম্যানের মতো বাইরে চাড্ডি পরা জনগণকে বলছি, আপনি যদি নিজেকে গোপাল পাঁঠার মতো ভেবে বা নিজেকে ওনার অনুরাগী ভেবে গর্বিত বোধ করেন তা হলে আমিও আপনাকে গোপাল পাঁঠা উপাধি দিয়ে ভূষিত করলাম। এরপর থেকে নিজের নামের আগে গোপাল পাঁঠা বা গোপালের পাঁঠা লিখতে পারেন সবর্ত্র। অভিনন্দন! #জয়বাংলা https:// twitter.com/prasunmaitra/s tatus/1085174413232812032 …",,,#জয,1.08535132576267E+018,https://twitter.com/Dipanjan_A/status/1085351325762674688
1,"গো হত্যার প্রতিবাদ করলে আমি সাম্প্রদায়িক। Rss-BJP র দালাল, চাড্ডি । আর NRS এর কুকুর হত্যার প্রতিবাদ করলে পশুপ্রেমী..মহামানব।",,,,1.08523291524666E+018,https://twitter.com/TanmoyKantiPaul/status/1085232915246661632
1,"ঠিক বইমেলা আসার আগে শ্রীজাতকে লোকজন, মানে ""চাড্ডির দল"" আক্রমণ করে; খুব খারাপ, খুউব !! পাঁজি দেখে কেন তোরা বইমেলার আগেই ওর কন্ডম ফাটাস বাবারা ?? এই জন্যই বোকা চাড্ডি বলে !! নিন্দেতে ভরে গেছে চারপাশ !! শিল্পীর... https://www. facebook.com/10000936300372 0/posts/2246707578984654/ …",,,,1.08438031099179E+018,https://twitter.com/debtanu1971/status/1084380310991785985
1,একদম ঘেসো আর চাড্ডি দের তো গলায় গলায় মিল,,,,1.08253821301557E+018,https://twitter.com/Cr7Saptarshi/status/1082538213015572480
1,কেরালার চাড্ডি ধোলায় নীতি বাংলা তথা ভারতের সব রাজ্যে প্রয়োগ করা হোক।,,,,1.08189130312901E+018,https://twitter.com/speak2KAZI/status/1081891303129010176
